{
  "schema_version": "1.0.0",
  "episode_id": "PD-2026-007-riley",
  "revision": "v001",
  "scenes": [
    {
      "scene_id": "S001",
      "script_span_ids": ["SPN-0001"],
      "purpose": "Cold open: present-tense arrest POV and the central phone-search question.",
      "primary_claim_id": "CLM-0001",
      "emotional_function": "immediate_stakes",
      "visual_mode": "reenactment",
      "duration_seconds": 28,
      "priority": "A",
      "required_assets": ["PD-2026-007-S001-IMG-001", "REM-hook-question", "SFX-pocket-phone-lift", "AMB-roadside-low"],
      "continuity_refs": ["present_phone", "symbolic_arrest_pov"],
      "transition_in": "hard_cut_from_black",
      "transition_out": "phone_glow_wipe",
      "on_screen_text": ["Can they search your phone?", "symbolic reconstruction"],
      "source_sensitivity": "medium",
      "human_review_required": true,
      "fallback_visual": "Macro object shot of a phone in a pocket with kinetic question typography; no people visible."
    },
    {
      "scene_id": "S002",
      "script_span_ids": ["SPN-0002"],
      "purpose": "Opening thesis: the old pocket rule meets a device that opens into a life.",
      "primary_claim_id": "CLM-0003",
      "emotional_function": "orientation",
      "visual_mode": "object",
      "duration_seconds": 44,
      "priority": "A",
      "required_assets": ["PD-2026-007-S002-IMG-001", "REM-window-into-life", "SFX-data-open", "AMB-low-digital"],
      "continuity_refs": ["present_phone", "wallet_vs_phone"],
      "transition_in": "phone_glow_wipe",
      "transition_out": "map_pin_cut",
      "on_screen_text": ["A phone is not an object. It's a window."],
      "source_sensitivity": "low",
      "human_review_required": false,
      "fallback_visual": "Remotion phone silhouette opening into layered icons and data tiles."
    },
    {
      "scene_id": "S003",
      "script_span_ids": ["SPN-0003"],
      "purpose": "Locate the Riley stop in San Diego, 2009, without depicting Riley's likeness.",
      "primary_claim_id": "CLM-0006",
      "emotional_function": "grounding",
      "visual_mode": "map",
      "duration_seconds": 22,
      "priority": "B",
      "required_assets": ["REM-san-diego-map-2009", "PD-2026-007-S003-IMG-001", "AMB-roadside-night"],
      "continuity_refs": ["san_diego_2009", "anonymous_vehicle"],
      "transition_in": "map_pin_cut",
      "transition_out": "police_light_flash",
      "on_screen_text": ["San Diego - 2009"],
      "source_sensitivity": "medium",
      "human_review_required": true,
      "fallback_visual": "Animated abstract San Diego map with a single roadside marker."
    },
    {
      "scene_id": "S004",
      "script_span_ids": ["SPN-0004"],
      "purpose": "Show the arrest pivot: car search, firearms found, phone taken from pocket.",
      "primary_claim_id": "CLM-0006",
      "emotional_function": "escalation",
      "visual_mode": "reenactment",
      "duration_seconds": 22,
      "priority": "A",
      "required_assets": ["PD-2026-007-S004-IMG-001", "PD-2026-007-S004-IMG-002", "REM-evidence-tag", "SFX-car-door", "SFX-evidence-bag"],
      "continuity_refs": ["anonymous_vehicle", "no_identifiable_faces"],
      "transition_in": "police_light_flash",
      "transition_out": "evidence_table_cut",
      "on_screen_text": ["symbolic reconstruction"],
      "source_sensitivity": "medium",
      "human_review_required": true,
      "fallback_visual": "Close detail of a sealed evidence bag and phone on a dark evidence table."
    },
    {
      "scene_id": "S005",
      "script_span_ids": ["SPN-0005"],
      "purpose": "Make the warrantless phone searches legible: scene search and station search.",
      "primary_claim_id": "CLM-0006",
      "emotional_function": "intrusion",
      "visual_mode": "object",
      "duration_seconds": 32,
      "priority": "A",
      "required_assets": ["PD-2026-007-S005-IMG-001", "REM-no-warrant-stamp", "REM-searched-twice", "SFX-stamp", "AMB-station-room"],
      "continuity_refs": ["present_phone", "evidence_table"],
      "transition_in": "evidence_table_cut",
      "transition_out": "case_file_slide",
      "on_screen_text": ["Searched twice. No warrant."],
      "source_sensitivity": "medium",
      "human_review_required": true,
      "fallback_visual": "Remotion split-screen: phone at roadside, phone at station, warrant box empty."
    },
    {
      "scene_id": "S006",
      "script_span_ids": ["SPN-0006"],
      "purpose": "Show the consequences of phone evidence without implying guilt beyond the record.",
      "primary_claim_id": "CLM-0006",
      "emotional_function": "stakes_rise",
      "visual_mode": "typography",
      "duration_seconds": 18,
      "priority": "B",
      "required_assets": ["REM-charge-escalation-card", "PD-2026-007-S006-IMG-001", "SFX-paper-hit"],
      "continuity_refs": ["case_file", "neutral_defendant_language"],
      "transition_in": "case_file_slide",
      "transition_out": "court_steps_cut",
      "on_screen_text": ["Traffic stop -> shooting case"],
      "source_sensitivity": "medium",
      "human_review_required": true,
      "fallback_visual": "Neutral case-file typography; no face, no gang imagery."
    },
    {
      "scene_id": "S007",
      "script_span_ids": ["SPN-0007"],
      "purpose": "Introduce the companion Wurie case and merge both phones into the central question.",
      "primary_claim_id": "CLM-0005",
      "emotional_function": "central_question",
      "visual_mode": "object",
      "duration_seconds": 28,
      "priority": "A",
      "required_assets": ["PD-2026-007-S007-IMG-001", "REM-two-cases-one-question", "SFX-click-flip-phone"],
      "continuity_refs": ["smartphone_and_flip_phone", "no_identifiable_faces"],
      "transition_in": "court_steps_cut",
      "transition_out": "legal-rule-card",
      "on_screen_text": ["Riley v. California + United States v. Wurie"],
      "source_sensitivity": "medium",
      "human_review_required": true,
      "fallback_visual": "Two anonymous phones on a dark table with case-name lower third."
    },
    {
      "scene_id": "S008",
      "script_span_ids": ["SPN-0008"],
      "purpose": "Name the doctrine that makes the conflict possible.",
      "emotional_function": "legal_orientation",
      "visual_mode": "typography",
      "duration_seconds": 12,
      "priority": "B",
      "required_assets": ["REM-search-incident-title", "SFX-text-reveal"],
      "transition_in": "legal-rule-card",
      "transition_out": "diagram_expand",
      "on_screen_text": ["Search incident to arrest"],
      "source_sensitivity": "low",
      "human_review_required": false,
      "fallback_visual": "Kinetic doctrine card over dark legal-paper texture."
    },
    {
      "scene_id": "S009",
      "script_span_ids": ["SPN-0009"],
      "purpose": "Explain the two traditional justifications with a clean Remotion diagram.",
      "primary_claim_id": "CLM-0003",
      "emotional_function": "clarity",
      "visual_mode": "diagram",
      "duration_seconds": 32,
      "priority": "A",
      "required_assets": ["REM-chimel-two-reasons", "REM-reach-radius", "SFX-two-step", "AMB-low-digital"],
      "continuity_refs": ["diagram_style"],
      "transition_in": "diagram_expand",
      "transition_out": "wallet_cut",
      "on_screen_text": ["1) Officer safety  2) Preserve evidence"],
      "source_sensitivity": "low",
      "human_review_required": false,
      "fallback_visual": "Static two-column card with icons for safety and evidence."
    },
    {
      "scene_id": "S010",
      "script_span_ids": ["SPN-0010"],
      "purpose": "Present the government's wallet analogy before turning against it.",
      "emotional_function": "opposing_argument",
      "visual_mode": "object",
      "duration_seconds": 23,
      "priority": "B",
      "required_assets": ["PD-2026-007-S010-IMG-001", "REM-wallet-phone-question", "SFX-table-tap"],
      "continuity_refs": ["wallet_vs_phone"],
      "transition_in": "wallet_cut",
      "transition_out": "data_explosion",
      "on_screen_text": ["If a wallet, why not a phone?"],
      "source_sensitivity": "low",
      "human_review_required": false,
      "fallback_visual": "Wallet and phone side by side with Remotion question overlay."
    },
    {
      "scene_id": "S011",
      "script_span_ids": ["SPN-0011"],
      "purpose": "Make the quantitative and qualitative difference visual: wallet items versus phone data layers.",
      "primary_claim_id": "CLM-0004",
      "emotional_function": "revelation",
      "visual_mode": "data_visualization",
      "duration_seconds": 30,
      "priority": "A",
      "required_assets": ["PD-2026-007-S011-IMG-001", "REM-wallet-vs-smartphone-data", "SFX-data-burst"],
      "continuity_refs": ["wallet_vs_phone", "data_layers"],
      "transition_in": "data_explosion",
      "transition_out": "cloud_thread_wipe",
      "on_screen_text": ["Wallet vs. smartphone"],
      "source_sensitivity": "low",
      "human_review_required": false,
      "fallback_visual": "Fully Remotion-rendered data-layer contrast."
    },
    {
      "scene_id": "S012",
      "script_span_ids": ["SPN-0026"],
      "purpose": "Extend the phone into cloud data so the search feels larger than the device.",
      "primary_claim_id": "CLM-0004",
      "emotional_function": "scale",
      "visual_mode": "diagram",
      "duration_seconds": 24,
      "priority": "A",
      "required_assets": ["PD-2026-007-S012-IMG-001", "REM-pocket-cloud-diagram", "SFX-network-pulse"],
      "continuity_refs": ["present_phone", "cloud_threads"],
      "transition_in": "cloud_thread_wipe",
      "transition_out": "reasons_strip_away",
      "on_screen_text": ["Half in your pocket, half in the cloud"],
      "source_sensitivity": "low",
      "human_review_required": false,
      "fallback_visual": "Remotion phone-to-cloud network diagram."
    },
    {
      "scene_id": "S013",
      "script_span_ids": ["SPN-0012"],